{
 "$schema": "https://json-schema.org/draft/2020-12/schema",
 "properties": {
  "agents": {
   "items": {
    "type": "string"
   },
   "type": "array"
  },
  "blocked": {
   "type": "number"
  },
  "captures": {
   "type": "number"
  },
  "hashed_files": {
   "type": "number"
  },
  "head": {
   "properties": {
    "commit": {
     "type": "string"
    },
    "commits": {
     "type": "number"
    },
    "subject": {
     "type": "string"
    }
   },
   "required": [
    "commit",
    "commits",
    "subject"
   ],
   "type": "object"
  },
  "latest_capture": {
   "type": "string"
  },
  "note": {
   "type": "string"
  },
  "opened": {
   "type": "string"
  },
  "primary": {
   "type": "number"
  },
  "sources": {
   "type": "number"
  }
 },
 "required": [
  "agents",
  "blocked",
  "captures",
  "hashed_files",
  "head",
  "latest_capture",
  "note",
  "opened",
  "primary",
  "sources"
 ],
 "title": "vault.json",
 "type": "object"
}
