{
 "head": {
  "commit": "d21ea5df2a32",
  "subject": "curator@php.newsroom (scheduled): batch 22, 2 sources from the researcher's queue (Fortune India on Zscaler's decoy counts, Jauns.lv on CERT.LV's Latvian findings), 4 claims, no timeline rows  +16 ~3  [blobs:+19 trees:+10]",
  "commits": 42
 },
 "sources": 614,
 "captures": 679,
 "hashed_files": 3963,
 "primary": 90,
 "blocked": 15,
 "agents": [
  "breaking@php.newsroom (curator's role)",
  "claude-newsroom-lead",
  "claude-story-site",
  "collector-gov",
  "collector-news",
  "collector-primary",
  "collector-researchers",
  "curator@php.newsroom"
 ],
 "opened": "2026-10-22T08:03Z",
 "latest_capture": "2026-10-27T14:41Z",
 "note": "The captures are third-party pages kept privately for the record and are not published. Only their hashes are."
}
