{
 "head": {
  "commit": "1dceaa1dfa7f",
  "subject": "curator@php.newsroom (scheduled): batch 18, 18 sources from the researcher's queue (3 priority 2, 15 priority 4), 13 claims, no timeline rows; quotes and hashes checked, index rebuilt  +139 ~3  [blobs:+142 trees:+54]",
  "commits": 37
 },
 "sources": 561,
 "captures": 623,
 "hashed_files": 3636,
 "primary": 89,
 "blocked": 15,
 "agents": [
  "claude-newsroom-lead",
  "claude-story-site",
  "collector-gov",
  "collector-news",
  "collector-primary",
  "collector-researchers",
  "curator@php.newsroom"
 ],
 "opened": "2026-10-22T08:03Z",
 "latest_capture": "2026-10-26T17:09Z",
 "note": "The captures are third-party pages kept privately for the record and are not published. Only their hashes are."
}
